{
  "pack_schema_version": "1",
  "pack_id": "2026-06-25-code-of-practice-statistics-method",
  "title": "Code of Practice for Statistics Method Evidence Pack",
  "status": "draft",
  "created_at": "2026-06-25T08:20:00Z",
  "updated_at": "2026-06-25T08:20:00Z",
  "research_question": "What does the official Code of Practice for Statistics homepage say about the purpose and benefit of the Code?",
  "scope": "Controlled real/sandbox method pack using one official public source. This pack tests Evidence Pack v1 workflow structure and traceability. It is not a TWIS article pack.",
  "editorial_risk": "low",
  "publishability": "not_ready",
  "human_review_required": true,
  "records": {
    "source_records": "sources/source-records.jsonl",
    "source_authority_map": "sources/source-authority-map.jsonl",
    "claim_records": "claims/claim-records.jsonl",
    "evidence_items": "evidence/evidence-items.jsonl",
    "search_diary": "search/search-diary.jsonl",
    "negative_evidence_log": "search/negative-evidence-log.jsonl",
    "public_record_timeline": "timeline/public-record-timeline.jsonl",
    "denial_checks": "timeline/denial-checks.jsonl",
    "human_review": "review/human-review.jsonl"
  },
  "outputs": {
    "final_brief": "output/final-brief.md",
    "evidence_summary": "output/evidence-summary.md",
    "contradiction_brief": "output/contradiction-brief.md"
  },
  "notes": "First controlled real/sandbox Evidence Pack. It uses one official public source and makes only a narrow source-description claim."
}
