{
    "pack_schema_version":  "1",
    "pack_id":  "2026-06-25-power-profile-generic-leadership-mp",
    "title":  "Power Profile: UK political leadership candidate or MP",
    "status":  "draft",
    "created_at":  "2026-06-25T18:18:15Z",
    "updated_at":  "2026-06-25T18:18:15Z",
    "research_question":  "What does this political figure say they stand for, and what interests sit close to their power?",
    "scope":  "Power Profile starter pack created from simple intake. Public power network research only; private-life material, gossip, rumours, and unevidenced associations are out of scope.",
    "editorial_risk":  "medium",
    "publishability":  "not_ready",
    "human_review_required":  true,
    "records":  {
                    "source_records":  "sources/source-records.jsonl",
                    "source_authority_map":  "sources/source-authority-map.jsonl",
                    "claim_records":  "claims/claim-records.jsonl",
                    "evidence_items":  "evidence/evidence-items.jsonl",
                    "search_diary":  "search/search-diary.jsonl",
                    "negative_evidence_log":  "search/negative-evidence-log.jsonl",
                    "public_record_timeline":  "timeline/public-record-timeline.jsonl",
                    "denial_checks":  "timeline/denial-checks.jsonl",
                    "human_review":  "review/human-review.jsonl"
                },
    "outputs":  {
                    "final_brief":  "output/final-brief.md",
                    "evidence_summary":  "output/evidence-summary.md",
                    "contradiction_brief":  "output/contradiction-brief.md"
                },
    "notes":  "Created by tools/new-pack.ps1 as a power_profile starter pack. Power Profile intake metadata is stored in manifest.json until pack_type is added to Evidence Pack v1 pack.json."
}
