{
  "pack_schema_version": "1",
  "pack_id": "2026-06-24-story-evidence-collector-foundation",
  "title": "Story Evidence Collector Foundation Evidence Pack",
  "status": "draft",
  "created_at": "2026-06-24T00:00:00Z",
  "updated_at": "2026-06-24T00:00:00Z",
  "research_question": "What does the current Story Evidence Collector foundation prove, and what does it not prove yet?",
  "scope": "Repository-owned workflow proof only. This pack uses repository files and repository documentation as evidence for the current Evidence Pack v1 foundation.",
  "editorial_risk": "low",
  "publishability": "not_ready",
  "human_review_required": true,
  "records": {
    "source_records": "sources/source-records.jsonl",
    "source_authority_map": "sources/source-authority-map.jsonl",
    "claim_records": "claims/claim-records.jsonl",
    "evidence_items": "evidence/evidence-items.jsonl",
    "search_diary": "search/search-diary.jsonl",
    "negative_evidence_log": "search/negative-evidence-log.jsonl",
    "public_record_timeline": "timeline/public-record-timeline.jsonl",
    "denial_checks": "timeline/denial-checks.jsonl",
    "human_review": "review/human-review.jsonl"
  },
  "outputs": {
    "final_brief": "output/final-brief.md",
    "evidence_summary": "output/evidence-summary.md",
    "contradiction_brief": "output/contradiction-brief.md"
  },
  "notes": "First bounded repository-based Evidence Pack workflow proof."
}
